name,lat,long,review,cusine,num_rate,cost_one,Location
Antarastriya,12.94302901,77.57031888,8,"pizza, fast food, chinese, beverages, shake, italian, mexican, juices",3.6,100,basavanagudi
Rotti Mane,12.91891703,77.5917913,27,south indian,4.2,200,jayanagar
Marwadi Chaat & Tiffin Services,12.96048903,77.59820078,85,"north indian, street food, chinese, beverages",3.7,200,shanti nagar
Haka,12.91990753,77.58359447,649,"chinese, momos",4.2,200,jayanagar
Firangi Bake,12.91542494,77.58579656,700,"italian, mexican",3.8,200,jp nagar
Snack House,12.92729,77.58585,30,"fast food, momos",3.9,200,jayanagar
Gowdru Mudde Mane,12.88826917,77.58213401,593,"south indian, biryani, chinese, north indian",4,200,jp nagar
Aramane Donne Biriyani,12.94174974,77.61559624,21,"biryani, north indian, south indian, andhra, seafood, chinese",4.1,200,koramangala 8th block
Friendly Neighbourhood Pizza - Man,12.92824996,77.58152246,6,"pizza, italian, ice cream, shake",4.3,200,jayanagar
Aramane Donne Biriyani,12.90956806,77.57323042,19,"south indian, biryani, chinese",3.9,200,jp nagar
The Ganache Factory,12.91868501,77.57790618,1671,"bakery, desserts",4.2,200,jayanagar
7th Heaven Cakes And Desserts,12.88482077,77.58272175,104,"bakery, desserts",4.1,200,jp nagar
Hungry Bird,12.92194864,77.61653602,106,"biryani, north indian, chinese, rolls, fast food, sichuan",3.9,200,btm
Biryani Mount,12.9350818,77.6132986,303,"biryani, north indian",3.7,200,koramangala 7th block
Kulfi Shulfi- Kulfis and¬†Ice Cream,12.9175447,77.6030484,23,"ice cream, desserts",4,200,btm
Brundavan Upachar,12.9125683,77.5463149,477,"south indian, north indian, chinese, biryani, street food, ice cream, desserts, beverages",4.1,200,uttarahalli
Udupi Upachar,12.920783,77.5694282,80,"south indian, north indian, chinese, street food, beverages, shake, sandwich, ice cream",3.9,200,jayanagar
Uttara Karnatakada Prasidda Jolada Roti Mattu Chapathi Angadi,12.92962046,77.55187165,4,"south indian, street food, mithai",4,200,banashankari
Recipe,12.90947983,77.56501146,436,"north indian, chinese, mughlai, biryani, sichuan",4,150,kumaraswamy layout
SLAY Coffee,12.94115406,77.57999394,1092,coffee,4.2,150,basavanagudi
Chef Bakers,12.93598956,77.61497095,10,"bakery, fast food, pizza, sandwich, burger, desserts",4.1,150,koramangala 7th block
Dum Safar Biryani,12.914345,77.599555,39,"biryani, kebab, north indian, bbq, desserts, beverages",4,200,btm
Punjabites By Empire,12.93506154,77.61326808,281,"north indian, mughlai, biryani, desserts, beverages",3.8,200,koramangala 7th block
SGS Non Veg - Gundu Pulav,12.89111126,77.59452246,115,south indian,4,200,bannerghatta road
Puliyogare Point,12.94073515,77.57046908,754,"south indian, desserts",4.3,200,basavanagudi
Uttara Karnataka Jolada Rotati & Chapati Store,12.95618295,77.56748177,8,"south indian, street food",4,200,basavanagudi
Habibi Falafel,12.90562779,77.59567279,27,"arabian, fast food, beverages, desserts",4.3,200,jp nagar
Punjab Grill,12.99130084,77.57045634,45,north indian,4,400,malleshwaram
FB Caf√©¬†By¬†Frozen Bottle,12.9063582,77.58973639,28,bakery,3.5,400,jp nagar
Rolls Kitchen,12.96204951,77.59732839,5,"rolls, fast food, beverages",4.2,400,langford town
Punjabi Food Corner,12.8850636,77.58202437,268,"north indian, chinese, street food, fast food, desserts, beverages",3.5,400,jp nagar
Bowl 99,12.920758,77.611868,263,"north indian, south indian",3.5,400,btm
Maharaja Military Canteen,12.9256514,77.5642303,138,"south indian, biryani",4,400,banashankari
Simplee Shawarma,12.913717,77.607126,1268,"lebanese, fast food",4.1,400,btm
Swiss Cream,12.95860507,77.59436656,9,"ice cream, waffle, desserts, sandwich, shake, beverages",3.9,400,shanti nagar
Sindhoora Gardenia,12.92416652,77.55306691,91,"andhra, north indian, mughlai, chinese, seafood, biryani, beverages, desserts",4,300,banashankari
New Udupi Upahar,12.91910951,77.58361693,61,"south indian, north indian, chinese, street food, beverages, shake",3.9,300,jayanagar
Udupi Upahar,12.9042431,77.5858135,14,"north indian, south indian, chinese, street food, fast food, beverages",4,300,jp nagar
Hungry Chang,12.93507004,77.61330832,1033,"chinese, fast food, sichuan",3.7,300,koramangala 7th block
Olio - The Wood Fired Pizzeria,12.9124119,77.606411,23,"pizza, italian",3.7,300,btm
Basaveshwar Khanavali,12.93289702,77.58417081,32,south indian,4.3,300,jayanagar
Rolls & Bowls Company,12.93520923,77.60948238,33,"rolls, north indian, chinese, fast food, sichuan",3.7,250,hosur road
Rotti Mane,12.88917383,77.60289464,4,south indian,4,250,bannerghatta road
Sagar Fast Food,12.94161871,77.62155812,195,"south indian, north indian, street food, chinese, beverages, shake",4,250,koramangala 8th block
New Prashanth Hotel,12.94490786,77.57200163,103,south indian,4.2,250,basavanagudi
Fiero! Pizzeria,12.8985582,77.59132661,501,"pizza, fast food",3.4,250,near jp nagar
Manjushree Veg,12.89017033,77.59407889,131,"north indian, chinese",4.1,250,bannerghatta road
Uttara Karnataka Jolada Rotti Mattu Chapati Angadi,12.94463894,77.57032525,21,"south indian, mithai",4.2,250,basavanagudi
Sri Sai 99 Variety Dosa,12.92687586,77.55099658,1189,"south indian, fast food, sichuan",4.1,250,banashankari
Akram Hotel,12.91700661,77.56827336,343,"south indian, biryani, mughlai",3.3,100,kumaraswamy layout
Skyline Pizzeria,12.90631343,77.57781263,1178,"cafe, bakery, pizza, pasta, desserts, beverages",3.9,100,jp nagar
Asia Kitchen By Mainland China,12.9199157,77.58357905,7,"chinese, momos, thai, asian, seafood, sushi, beverages",3.8,100,jayanagar
New Prashanth Hotel,12.92393353,77.55334653,310,"andhra, beverages",4.1,100,banashankari
Kunafa World,12.9415105,77.621107,1647,desserts,4.4,100,koramangala 8th block
Kundana,12.90458985,77.60148916,482,"andhra, mughlai, north indian, chinese, seafood, biryani, desserts, beverages",3.6,100,bannerghatta road
Mangalore Sea Palate,12.93083835,77.58288369,30,"north indian, mughlai, seafood, chinese, sichuan, beverages",4.2,100,jayanagar
Twiststick House,12.94945494,77.57461812,200,"chinese, fast food, beverages",3.9,100,basavanagudi
Mallu House,12.935099,77.613337,39,"kerala, south indian, biryani, kebab, desserts, seafood",3.6,200,koramangala 7th block
Dwaraka Grand,12.90947166,77.56540842,209,"south indian, chinese, street food, shake, sichuan",4,200,kumaraswamy layout
Uru Brewpark,12.90616506,77.60162193,7690,"italian, north indian, continental, asian, desserts, beverages",3.9,200,jp nagar
Banashankari Donne Biriyani,12.94163897,77.55758643,11762,south indian,4.3,200,banashankari
The Red Box,12.916611,77.595583,3963,"chinese, thai, sichuan",3.8,200,jayanagar
Malabar Bay,12.93545203,77.60767836,1709,"kerala, seafood, north indian, biryani, chinese, beverages, shake, desserts",3.6,200,btm
Keventers Ice Cream,12.91381024,77.60836534,288,"ice cream, desserts, shake, beverages",4.1,200,btm
Boss Burger,12.93568175,77.61402816,391,"burger, fast food, desserts, beverages, shake",4.3,200,koramangala 7th block
Dakshin Cafe,12.88639349,77.58225169,211,"south indian, north indian, chinese",4.1,50,jp nagar
Kaveri Foods Andhrastyle,12.90446925,77.6016568,5301,"north indian, chinese, biryani, andhra, seafood, ice cream",3.5,50,bannerghatta road
Koramangala Social,12.93553339,77.61407778,6034,"north indian, chinese, biryani, burger, pasta, pizza, kebab, rolls",4,50,koramangala 7th block
BigBites,12.92729,77.58585,8,"fast food, momos, street food",4,50,jayanagar
Adithya,12.91198181,77.5869526,374,"south indian, north indian, chinese, street food, beverages, ice cream",3.8,50,jp nagar
Dragon's Kitchen,12.93017206,77.58167937,167,"chinese, sichuan",3.7,50,jayanagar
No Sugar Please!,12.93135727,77.60775581,1747,"beverages, juices, healthy food",4.4,200,hosur road
Tiwari's Ghee Paratha And Chaats,12.93872687,77.57067729,3,"north indian, rajasthani, street food",4,200,basavanagudi
Giani Ice Cream,12.92803344,77.58087158,45,"ice cream, shake, beverages, desserts",3.7,200,jayanagar
Burger It Up,12.91769157,77.57660732,93,"burger, beverages, desserts, american, cafe",3.7,200,jayanagar
Shrinidhi Military Hotel,12.93680223,77.5760806,43,"south indian, biryani",3.9,200,basavanagudi
Sahana's - Since 1993,12.94727029,77.59873923,200,"south indian, mughlai",3.8,200,wilson garden
Dilli Chowk,12.86283335,77.58043919,93,north indian,4,200,jp nagar
Manjushree's Gowdru Mudde Mane,12.91461873,77.55887557,21,south indian,4.1,200,near uttarahalli
Lo! - Low Carb And Keto Foods,12.89277032,77.5868667,1433,"healthy food, north indian, fast food, desserts",4.2,150,jp nagar
Ranganna Military Hotel,12.92958256,77.57377122,1093,south indian,4,150,jayanagar
Kouzina Kafe - The Food Court,12.91769059,77.57660765,68,"fast food, bakery, desserts",3.7,150,jayanagar
Prashanth Gowdru Badoota,12.88245742,77.59544715,6,"south indian, chinese",4.2,150,bannerghatta road
Chianti,12.90780496,77.60123167,1464,"pizza, pasta, italian, salad, desserts, beverages, juices",4,150,bannerghatta road
Nizam's Kitchens,12.935177,77.613464,270,"biryani, mughlai, andhra, hyderabadi, south indian, north indian",3.6,150,koramangala 7th block
Eat N Drink,12.93095011,77.60673791,98,"fast food, sandwich, burger, wraps, rolls, shake, juices, beverages",4.3,200,btm
Paratha Junction,12.89109525,77.59542469,119,"north indian, chinese",3.3,200,bannerghatta road
Just Bake - Cakes & Confectioners,12.91400665,77.60987878,733,"bakery, desserts",3.9,200,btm
Eshanya Street Food Cafe,12.92326133,77.59314112,1214,"north indian, mughlai, chinese, beverages",3.9,200,jayanagar
Punjabi Pure Veg Restaurant Since 1994,12.97082148,77.57411655,38,"north indian, beverages, chinese",3.8,200,majestic
The Pastry House,12.94796725,77.59711314,774,bakery,4.1,200,wilson garden
O4H - Order For Health,12.91502036,77.60554232,1901,"healthy food, salad, beverages",4.3,200,btm
Sandos 'n Grills,12.8856829,77.5964685,815,"continental, fast food, burger, desserts, beverages, pasta, sandwich, salad",4.3,200,bannerghatta road
The Sip Shop,12.9578493,77.5658143,43,"fast food, ice cream, desserts, beverages, shake",4.1,100,city market
Kamat Bugle Rock,12.93996955,77.56670326,591,"south indian, fast food, chinese, street food, north indian, desserts, beverages",4.4,100,basavanagudi
Mega Biryani,12.92729,77.58585,7,biryani,4,100,jayanagar
GLOBO Ice Creams Of The World,12.91676773,77.58573152,23,"ice cream, desserts",4,100,jayanagar
Sri Raghavendra Davanagere Benne Dose Hotel,12.9090584,77.5730598,134,south indian,3.6,100,jp nagar
Lassi Shop,12.926287,77.56101966,12,"beverages, ice cream, desserts, shake, juices",3.8,100,banashankari
Brundhavana Pure Veg,12.87287764,77.58365314,109,"south indian, north indian, chinese, biryani, ice cream, beverages, sichuan",3.7,100,bannerghatta road
Little Italy,12.92731799,77.5761158,970,"italian, shake, beverages, desserts",3.7,100,jayanagar
Art Of Delight,12.9335156,77.62197454,548,"ice cream, desserts, waffle, beverages",4.1,100,koramangala 5th block
Thali 99,12.920758,77.611868,115,"north indian, mughlai",3.3,100,btm
Just Cakes,12.906776,77.545331,148,"bakery, desserts",4,100,uttarahalli
RR Vatika,12.9276586,77.5809887,0,"street food, chinese, sandwich, north indian, desserts, beverages",3.9,100,jayanagar
Samosa Singh,12.89501418,77.58212093,4274,"street food, fast food, tea, north indian",3.7,200,jp nagar
Deewar Family Restaurant and Bar,12.958601,77.5257141,246,"north indian, seafood, chinese, mughlai, beverages, sichuan",4.3,200,vijay nagar
Sri Krishna Sagar,12.89406215,77.56820463,35,"north indian, south indian, chinese, fast food, desserts, beverages",4,200,kanakapura road
ITC Sunfeast Baked Creations,12.93506187,77.61325534,183,"bakery, desserts, , cafe, continental, sandwich",4.2,200,koramangala 7th block
HomeSe Just Veg,12.89214272,77.59843145,718,"south indian, north indian",3.7,200,bannerghatta road
Taiki,12.93496809,77.58312508,795,"japanese, korean, asian, sushi, beverages",4,200,jayanagar
The Brooklyn Creamery - Healthy Ice Cream,12.94116811,77.57999595,186,ice cream,4.3,200,basavanagudi
Chinese Cloud,12.8992697,77.5859381,248,"chinese, fast food",3.6,200,jp nagar
Aramane Donne Biriyani,12.9306034,77.55368985,23,"biryani, andhra",3.9,200,banashankari
Chef Master,12.92373092,77.59700987,123,"biryani, seafood, kerala, north indian, south indian, chinese, beverages",3.8,200,jayanagar
India Sweet House,12.9285088,77.5824048,0,"mithai, street food",4.2,200,jayanagar
Food Court By Kitchens@,12.93519976,77.61347093,71,"north indian, south indian, chinese, mughlai, biryani, momos, desserts, beverages",3.1,200,koramangala 7th block
Grow Fit,12.89080993,77.58227114,1180,"healthy food, desserts, beverages",4,200,jp nagar
Panda Nation,12.92081828,77.56061167,430,"chinese, momos, thai, sichuan",4,200,banashankari
Chamarajpet Dose Corner,12.9549975,77.566295,233,south indian,4.2,200,city market
Garden Fresh,12.91262593,77.60998238,72,"beverages, juices, healthy food",4.2,200,btm
Brahma Brews,12.89325948,77.58632161,8745,"finger food, asian, italian, north indian, continental, european, south indian, desserts",4.3,150,jp nagar
Late Night,12.90448,77.601066,2659,"north indian, chinese, biryani, fast food, sichuan",4.1,150,btm
Simpli Namdhari's,12.9394134,77.58521989,12,"healthy food, european, pizza, fast food, beverages",3.9,150,jayanagar
RollsKing,12.935333,77.6135,78,"rolls, fast food, north indian",4.1,150,btm
The Bengal Club,12.90418,77.586639,748,"bengali, north indian, rolls",3.7,150,jp nagar
Kebab Xpress,12.92441455,77.56513417,11,"north indian, chinese, mughlai, parsi, kebab",3.7,150,banashankari
Cravy Wings,12.93170234,77.60744568,225,"burger, fast food, beverages",4.3,150,koramangala 7th block
Svadu Pure Ghee Sweets,12.91398638,77.60967258,344,"mithai, street food, fast food",3.4,150,btm
Big Pitcher,12.89271237,77.58593839,28,"finger food, continental, north indian, mughlai, biryani, chinese, desserts, beverages",4.1,150,jp nagar
The Betel Leaf Co - Originally from Bangalore,12.8951889,77.6077802,392,"paan, desserts",4.5,150,bannerghatta road
Chow San,12.88735176,77.59933736,107,"chinese, thai, momos, sichuan",3.9,150,bannerghatta road
Dwarkamai Pure Veg Restaurant,12.94422918,77.57272549,61,"north indian, chinese, street food, beverages, desserts, shake",4.1,150,basavanagudi
Vinny's,12.92437468,77.56477509,2430,"cafe, italian, continental, pizza, beverages, desserts",4.1,150,banashankari
Kerala Note Book,12.92705101,77.54795328,336,"kerala, biryani, south indian, north indian, desserts, beverages",3.5,150,banashankari
Banashankari Donne Biriyani,12.91220011,77.5671351,330,"biryani, chinese",3.4,150,kumaraswamy layout
Magic Chef Restaurant,12.9327703,77.6073545,8,"north indian, sichuan, chinese, mughlai, biryani, beverages",4.1,150,btm
Uttara Karnataka Jolada Rotti mattu Chapati Angadi,12.95894062,77.56224275,4,south indian,3.8,150,basavanagudi
Go Native,12.92255221,77.5846925,1706,"healthy food, south indian, fast food, north indian, beverages, desserts",3.7,150,jayanagar
Crispy Studio,12.90606473,77.59322762,25,"burger, fast food, wraps, biryani",4.3,150,jp nagar
Sri Udupi Grand,12.96110753,77.59994287,24,"south indian, north indian, chinese, street food, beverages, shake",3.6,150,shanti nagar
Donne Biriyani Grand,12.90930303,77.57332899,217,"biryani, south indian, chinese",3.9,150,jp nagar
Rajvardhan Foods,12.9182043,77.59257082,353,"street food, maharashtrian",4.1,250,jayanagar
Rooftop Cafe,12.92895907,77.58620661,920,"pizza, fast food, chinese, coffee, beverages",3.6,250,jayanagar
Kolkata Famous Kati Roll,12.90694743,77.54603315,800,rolls,3.9,250,banashankari
Juice Junction,12.94341262,77.56783046,58,"beverages, juices, fast food, shake",4.2,250,basavanagudi
Karavali Kolimane,12.94724251,77.59796105,64,"north indian, chinese, biryani, seafood, mangalorean, sichuan",4.1,150,wilson garden
Tandoori Knight,12.92562266,77.56418701,190,"north indian, chinese",3.9,150,banashankari
Mulabagilu Dosa,12.9167867,77.5418938,30,south indian,4.1,150,banashankari
Guntur Spice,12.91674322,77.58995701,1082,"andhra, chinese, north indian, beverages, desserts",4.1,200,jp nagar
Express By ABs,12.91650237,77.60475341,945,"north indian, biryani, bbq",3.7,200,btm
Davanagere Benne Dose Manne,12.95781632,77.56730709,546,south indian,4,200,basavanagudi
Namma Kudla,12.91269194,77.58612413,213,"mangalorean, north indian, chinese, biryani, seafood",4.2,200,jp nagar
Malabar Mess,12.8811249,77.59563055,87,"kerala, south indian, chinese",3.6,200,bannerghatta road
Basvangudi Donne Biryani,12.94763854,77.57347181,84,"biryani, south indian",4.2,100,basavanagudi
Chickpete Jonne Biriyani House,12.91356874,77.58610301,313,"biryani, north indian, fast food",4,100,jp nagar
Foodizo,12.92401293,77.56411258,62,"chinese, burger, pizza, pasta, sandwich, fast food, desserts, beverages",3.5,100,banashankari
Stories Bar & Kitchen,12.91353769,77.58604735,5604,"bar food, chinese, biryani, north indian, italian, bbq, desserts",3.9,100,jp nagar
Plan B,12.9261681,77.5647181,32,"american, continental, bar food, chinese, fast food, pizza, burger, beverages",4,500,banashankari
Copper Chimney,12.89346799,77.58621834,372,"north indian, mughlai, biryani, beverages",4,500,jp nagar
Chikpete Donne Biryani,12.91225011,77.56719276,226,"biryani, south indian",3.3,500,kumaraswamy layout
Sri Sai Cafe,12.95877333,77.56604645,19,"south indian, chinese, street food, north indian",3.8,100,basavanagudi
Pizza Stop,12.91984086,77.58950707,350,"pasta, pizza, fast food",3.8,100,jayanagar
Upahara Darshini,12.93638234,77.5769389,56,"north indian, chinese, beverages, juices, ice cream",4.1,100,basavanagudi
City Durbar,12.92848786,77.5964969,89,"north indian, chinese, biryani",3.7,100,jayanagar
Kollapuri's Cloud Kitchen,12.9473742,77.572757,519,"maharashtrian, chinese, north indian",3.7,100,basavanagudi
The Cake House,12.94170106,77.5619809,123,bakery,3.9,100,banashankari
A1 Biriyani Paradise,12.90731933,77.56381251,6,"biryani, kebab",3.8,100,kumaraswamy layout
Dolma Aunty Momos,12.89267729,77.5816732,140,"momos, fast food, street food, desserts",3.8,100,jp nagar
Udupi Grand,12.9368385,77.57272415,68,"south indian, north indian, chinese, fast food, street food, beverages, sichuan",4,100,basavanagudi
Mad Momos,12.89267729,77.5816732,224,momos,3.8,100,jp nagar
Pratyush's Food Plaza,12.89456415,77.5816207,85,"biryani, odia, north indian, chinese, mughlai, desserts, beverages",4,100,jp nagar
Basmati Express,12.92682456,77.54798882,710,"biryani, andhra, chettinad, hyderabadi, north indian, beverages",3.6,100,banashankari
The Baklava Company,12.935555,77.617668,137,desserts,3.8,100,koramangala 5th block
Juice Shop,12.93504586,77.61329893,4599,"beverages, desserts, ice cream, juices, shake",3.9,150,koramangala 5th block
L. J. Iyengar's Bakery,12.93241111,77.56775267,394,"bakery, desserts",3.8,150,basavanagudi
Artinci - Indulge Guilt Free!,12.92674744,77.55080514,157,"desserts, ice cream, bakery",3.5,150,banashankari
Amritsari Kulcha Land,12.90019293,77.58590452,453,"north indian, chinese, street food",3.9,150,jp nagar
Polamma's Mess,12.93650357,77.60832176,215,"andhra, biryani, south indian, chinese, north indian",4.2,150,btm
Hunger Hunt,12.91195142,77.54371338,7,"pizza, burger, fast food, beverages",3.8,150,uttarahalli
Iyengars Bakery,12.88557967,77.57895928,1064,"bakery, mithai, street food, desserts, fast food",3.9,150,jp nagar
Coast @ JP Nagar,12.89323595,77.58627668,41,"seafood, north indian, south indian, beverages",4,150,jp nagar
Paratha Box by EatFit,12.9124119,77.606411,218,"north indian, desserts, beverages",3.6,150,btm
Puliyogare Palace,12.94195,77.606691,63,"south indian, desserts",2.9,150,hosur road
Apna Dhaba,12.94014568,77.56438416,18,"north indian, chinese",4.1,150,basavanagudi
Donne Biryani & Kabab Corner,12.91222135,77.56716728,33,"biryani, south indian",3.5,150,kumaraswamy layout
JCB - Just Chole Bhature,12.9271932,77.5794441,7,"north indian, street food, sichuan",3.7,150,jayanagar
Swathi Restaurant,12.91045141,77.58866183,105,"mangalorean, north indian, chinese",4.2,150,jp nagar
Dakshin,12.95099229,77.59545788,97,"north indian, south indian",3.9,150,wilson garden
Rasoi,12.92682456,77.56450485,107,"north indian, chinese",4,150,banashankari
Coastal Mama,12.90616506,77.5932578,511,"konkan, mangalorean, north indian, biryani, seafood, desserts, beverages",4.1,200,jp nagar
Rolls And Chicken Combos,12.96117648,77.5981183,522,"north indian, chinese, rolls",3.5,200,shanti nagar
Nando's,12.935056,77.613333,951,"burger, fast food, portuguese",4.1,200,koramangala 7th block
Cheesecake & Co.,12.941437,77.620728,359,"bakery, desserts",4.5,200,koramangala 8th block
Sundae Everyday Ice Creams,12.91774843,77.5766214,486,"beverages, ice cream, desserts",4.3,200,jayanagar
Absolute Momo Cafe,12.90856772,77.56413605,25,"momos, chinese, north indian, fast food, street food, beverages",3.9,200,kumaraswamy layout
HRX by EatFit,12.9124119,77.606411,38,"healthy food, beverages, mediterranean, burger, desserts, wraps, pizza, salad",3.9,200,btm
Nirula's,12.90600742,77.55841597,0,ice cream,-,200,kumaraswamy layout
J K Coastal Curry,12.93917715,77.57192016,42,"seafood, chinese, north indian",4,200,basavanagudi
The Lassi Park,12.93288199,77.58231606,205,"beverages, ice cream, desserts",4.3,200,jayanagar
Dande's Hyderabadi Biryani,12.9269654,77.54791338,1144,"andhra, biryani, north indian, chinese",3.7,150,banashankari
Hotel Prashanth Non Veg Nati Style,12.90695494,77.56348025,183,"biryani, north indian, south indian",3.6,150,kumaraswamy layout
Udupi Sri Krisna Vaibhava,12.93197225,77.57579226,416,"south indian, north indian, chinese, street food, biryani, ice cream, beverages",4,150,jayanagar
Havmor Ice Cream,12.92178198,77.59340197,62,"desserts, ice cream, beverages",4.1,150,jayanagar
Fabelle Chocolates,12.9351,77.61334,49,"desserts, bakery",4,150,koramangala 7th block
Shetty Lunch Home,12.92070424,77.58370779,93,"mangalorean, seafood, north indian, chinese, mughlai, street food, beverages, shake",4.3,150,jayanagar
Al Fillfilah Mandi Majlis,12.92837577,77.5958468,9,"arabian, rolls, north indian, mughlai",3.8,150,jayanagar
Jayanagara Tiffany's,12.9288773,77.5870503,88,south indian,4.1,50,jayanagar
Jayanagara Donne Biryani,12.9065484,77.59044316,68,"biryani, south indian",3.7,50,jp nagar
Wah Bawarchi,12.884915,77.5826277,79,"biryani, north indian",3.8,50,jp nagar
Mayura 1989 Andhra Speciality Restaurant,12.97583007,77.55263306,101,"andhra, mughlai, chinese, kebab, north indian, beverages, desserts",3.9,50,rajajinagar
Biryanis And More,12.9319545,77.5833729,124,"biryani, north indian, chinese",4,50,jayanagar
Basaveshwar Khanavali,12.92873621,77.58576572,85,south indian,4.1,50,jayanagar
Ambur Star Dum Biryani,12.91671413,77.59633027,38,"biryani, kebab",3.7,50,jayanagar
The House Of Barbeque,12.92012223,77.55222,163,"bbq, chinese, lebanese",3.5,50,banashankari
Kim Lee Restaurant,12.98477176,77.55364828,159,"chinese, seafood, sichuan",4.3,300,rajajinagar
Dock Frost'd,12.93517727,77.61353879,342,"ice cream, desserts, beverages, shake",4.4,300,bangalore koramangala 7th block
Bowl Soul,12.921678,77.569603,19,"fast food, beverages",3.4,300,banashankari
The Sugar Free Keto Kafe - Artinci,12.92719578,77.5508685,129,"desserts, ice cream, bakery",3.9,300,banashankari
Keshava Kabab Centre,12.91296318,77.58660927,11,"south indian, kebab, fast food",4.2,300,jp nagar
Mandya Gowdru Biriyani Mane,12.91179848,77.55276281,6,"chinese, mughlai, north indian",4.2,150,uttarahalli
Royal India Restaurant,12.90949225,77.56492596,80,"north indian, chinese, mughlai, kebab, rolls, biryani, sichuan",3.8,150,kumaraswamy layout
Kavali,12.9162812,77.5545697,526,"north indian, chinese, south indian",4.1,150,banashankari
Rajasthani Dhaba,12.96049099,77.59820111,27,"rajasthani, north indian",3.7,150,shanti nagar
Madhan Soudhe Ole Fish Tawa Fry,12.93264508,77.54481073,321,seafood,4.5,150,banashankari
Bombay & Kolkata Chats,12.94223923,77.57040907,209,street food,3.8,150,basavanagudi
Get Cake'd,12.9345183,77.5739279,44,"bakery, desserts, fast food",3.2,150,basavanagudi
Kolkata King,12.94032147,77.57999361,1694,"fast food, sandwich, rolls, ice cream, desserts, beverages",4,150,basavanagudi
Malgudi Naati Style Hotel,12.891527,77.5748599,2,"chinese, south indian, north indian",4.1,150,jp nagar
Sri Sri Cafe,12.90951326,77.56438777,72,"fast food, pizza, sandwich",4.3,150,kumaraswamy layout
Baisakhi,12.9463227,77.57011134,489,"north indian, beverages, desserts",4,150,basavanagudi
Kwality Walls Frozen Dessert And Ice Cream Shop,12.93978,77.545221,200,"ice cream, desserts",4.6,150,basavanagudi
Karavali Lunch Home,12.91399357,77.58611575,4,"south indian, chinese, seafood",4.1,200,jp nagar
Utsav Restaurant,12.94033814,77.56454173,87,"north indian, chinese",4,200,banashankari
Funky Punjab,12.90039882,77.58572549,371,"north indian, chinese, mughlai",3.7,200,jp nagar
Hotel New Karavali,12.94010908,77.55334619,68,"mangalorean, chinese, north indian",4.1,200,banashankari
Udupi Upachar,12.90334764,77.59180438,80,"south indian, north indian, chinese, street food, beverages",4,200,jp nagar
Hotel Empark,12.94549798,77.59521816,41,"south indian, north indian, chinese, mughlai, beverages, sichuan",3.9,100,wilson garden
Kamat Hotel,12.94911186,77.57985145,446,"south indian, north indian, chinese, street food, fast food, beverages, shake",3.6,100,basavanagudi
Bangarapet Bhel House,12.95508314,77.56509762,294,street food,4.2,100,basavanagudi
Dal Roti,12.91399161,77.58612044,144,"north indian, chinese",4.1,100,jp nagar
SLV Tiffin Center,12.9100996,77.5729631,43,south indian,3.6,100,jp nagar
Slay Coffee Bar,12.933545,77.6210361,66,coffee,4.3,100,koramangala 5th block
Sri Rajasthani Foods,12.89977591,77.58563798,52,"rajasthani, north indian, fast food",4,100,jp nagar
ATH - All Things Healthy!,12.89277032,77.5868667,256,healthy food,3.9,100,jp nagar
