name,lat,long,review,cusine,num_rate,cost_one,Location
Ovenstory Pizza,12.97817,77.63832,5111,"pizza, fast food",4.3,300,indiranagar
Empire Restaurant,12.96727162,77.60897622,3587,"north indian, biryani, kebab, chinese, south indian, mughlai, beverages",4,300,brigade road
Leon's Burgers & Wings,12.99772551,77.61095837,18,"burger, fast food, wraps, street food, desserts, beverages",4.3,300,frazer town
Truffles,12.97192841,77.60106303,1960,"burger, american, bakery, italian, oriental, continental, beverages, desserts",4.4,300,st. marks road
Domino's Pizza,12.98087155,77.64059342,419,"pizza, fast food, desserts, beverages",4.1,300,indiranagar
Biriyani Zone,12.97318824,77.67830025,73,"biryani, north indian, chinese, mughlai, kebab, seafood, ice cream, beverages",3.9,300,cv raman nagar
Sri Udupi Park,12.96209852,77.64941622,193,"south indian, north indian, chinese, street food, beverages, ice cream, shake",3.7,300,old airport road
LeanCrust Pizza- ThinCrust Experts,12.980606,77.646376,402,"pizza, fast food, beverages, desserts",4.4,300,indiranagar
Meghana Foods,12.97310133,77.60923974,2316,"biryani, andhra, north indian, seafood",4.4,300,residency road
McDonald's,12.97276383,77.62147095,161,"burger, fast food, beverages",3.8,200,ulsoor
KFC,12.9792802,77.6579585,0,"burger, fast food, biryani, desserts, beverages",3.5,200,cv raman nagar
Burger King,12.992986,77.661929,112,"burger, fast food, beverages, desserts",4.1,200,old madras road
Imperial Restaurant,12.97134292,77.60578506,453,"mughlai, north indian, biryani, chinese, seafood, ice cream, desserts, beverages",4,200,residency road
Rotti Walla,12.974159,77.635941,11413,"north indian, south indian, chinese, mughlai, biryani, fast food, beverages, desserts",3.9,200,indiranagar
A2B - Adyar Ananda Bhavan,12.98773396,77.61844072,71,"south indian, street food, north indian, chinese, fast food, beverages, desserts",4.1,200,ulsoor
Hyderabad Biryaani House,12.95947059,77.65609257,1419,"biryani, north indian, hyderabadi, mughlai, chinese",4,200,old airport road
M.M.A Kabab and Rolls,12.98223719,77.63395462,114,"north indian, mughlai, chinese, kebab, rolls, seafood, arabian, biryani",3.7,200,old madras road
Kailash Parbat,12.98257,77.6098,93,"north indian, street food, beverages",3.5,200,commercial street
Bhartiya Jalpan,12.98171152,77.60956228,133,"north indian, street food, rajasthani, bengali, mithai, beverages, desserts",3.8,200,commercial street
Pizza Hut,12.95891579,77.6542452,423,"pizza, fast food, desserts, beverages",3.6,200,old airport road
Nandhini Deluxe,12.99601369,77.61303205,476,"andhra, biryani, south indian, north indian, chinese, mughlai, desserts, beverages",4,200,frazer town
La Pino'z Pizza,12.93194056,77.6322075,792,"pizza, fast food",3.8,200,koramangala 4th block
Ambur Star Briyani Since 1890,12.93473347,77.61605088,6,"biryani, chettinad, chinese, north indian, south indian",3.9,200,koramangala 5th block
Pathaan Sir,12.99581702,77.61362717,133,"rolls, chinese, momos",3.8,200,frazer town
New Punjabi Hotel,12.95945425,77.65568454,252,"north indian, chinese",3.8,200,old airport road
Donne Biriyani House,12.9687023,77.6097824,418,"biryani, south indian",3.7,200,richmond road
Punjab Junction,12.98525724,77.67339751,319,"north indian, chinese, mughlai",3.7,200,kaggadasapura
Gowdru Hotel,12.97402365,77.63594851,177,"south indian, biryani",3.9,200,indiranagar
Nandhana Palace,13.01494651,77.63583351,1250,"biryani, andhra, north indian, chinese, mughlai, south indian, desserts, beverages",4,200,kammanahalli
Five Star Chicken,12.9677517,77.653375,2595,"rolls, fast food",3.3,200,jeevan bhima nagar
Thalassery Restaurant,12.96281321,77.60409245,254,"kerala, south indian, seafood, north indian, chinese, arabian, beverages, shake",3.6,200,richmond town
Al Daaz,12.92076338,77.6515194,1568,"north indian, mughlai, continental, fast food, biryani, beverages, desserts",4.3,200,hsr
Mani's Dum Biryani,12.97736333,77.61929199,252,"biryani, kebab",4.2,200,ulsoor
Kabab Magic,12.96409844,77.60657161,139,"north indian, kebab, hyderabadi, mughlai, chinese, rolls",3.6,100,richmond town
Polar Bear,12.97950983,77.65790977,2,"ice cream, desserts, beverages, shake",4.5,100,cv raman nagar
Kanti Sweets,12.95898212,77.66013164,3585,"mithai, street food",4.3,100,old airport road
Kritunga Restaurant,12.9478702,77.69925635,1698,"andhra, south indian, north indian, biryani, chinese, seafood",3.7,100,marathahalli
MOJO Pizza - 2X Toppings,12.98065723,77.64615297,9126,"pizza, fast food, desserts, beverages",4.4,100,indiranagar
Corner House Ice Creams,12.97367472,77.60932188,730,"ice cream, desserts, shake",4.5,100,residency road
Beijing Bites,12.99712573,77.61420082,274,"chinese, thai, seafood, healthy food, sichuan",4.1,100,frazer town
Andhra Gunpowder,12.968187,77.650777,11267,"andhra, biryani, south indian, desserts, beverages, hyderabadi",4.2,100,near jeevan bhima nagar
Behrouz Biryani,12.97817,77.63832,3895,"biryani, kebab, hyderabadi, lucknowi",4.1,100,indiranagar
Paakashala,12.97595487,77.61484623,5,"south indian, north indian, chinese, biryani, street food, beverages",4.2,100,ulsoor
CakeZone,13.007994,77.641945,373,"bakery, desserts",3.9,100,banaswadi
Sharief Bhai,12.9966847,77.61420049,716,"biryani, mughlai, kebab, afghan, street food, beverages, desserts",4.1,100,frazer town
BOX8 - Desi Meals,12.98066278,77.64614291,16945,"north indian, wraps, fast food, biryani, desserts, beverages",4.2,250,indiranagar
RNR Biryani - Taste Of 1953,13.01501976,77.635711,560,"biryani, south indian, andhra",4,250,kammanahalli
Subway,12.97900865,77.6580536,118,"healthy food, fast food, sandwich, salad, beverages, wraps",3.7,250,cv raman nagar
Faasos - Wraps & Rolls,12.97135959,77.65835099,5507,"rolls, wraps, fast food",4,250,thippasandra
Paradise Biryani,12.91216318,77.64359917,432,"biryani, north indian, kebab",3.8,250,near hsr
FreshMenu,12.9939644,77.6638581,18038,"continental, healthy food, fast food, burger, sandwich, chinese, pasta, beverages",3.8,250,cv raman nagar
Taco Bell,12.99282708,77.66149649,1,"mexican, fast food, wraps, beverages",4.1,250,old madras road
EatFit,13.00842949,77.65169106,1955,"healthy food, north indian, pizza, burger, pasta, biryani, chinese, beverages",3.8,250,banaswadi
Dindigul Thalappakatti,12.97225382,77.61873141,377,"biryani, north indian, south indian, chinese, seafood, beverages",3.9,250,mg road
California Burrito,12.93420671,77.61701278,1533,"mexican, fast food, beverages",4.3,250,koramangala 5th block
WOW! Momo,12.979198,77.658234,0,"momos, fast food, tibetan",4,250,cv raman nagar
Potful - Claypot Biryanis,12.97220056,77.65281457,2181,"biryani, kebab, mughlai, north indian, desserts",4.2,250,thippasandra
Kapoor's Cafe,13.01787372,77.64301848,744,"north indian, beverages, desserts",3.9,200,kalyan nagar
Natural Ice Cream,12.97145564,77.60085046,251,"ice cream, beverages",4.5,200,st. marks road
Lassi Shop,13.00337779,77.66071402,0,"beverages, fast food, burger, shake, juices, ice cream, desserts",3.7,200,banaswadi
Biryani Trip - Destination Hyderabad,12.968187,77.650777,14113,"biryani, south indian, mughlai, andhra, desserts, hyderabadi",4.2,200,near jeevan bhima nagar
Madeena Hotel,12.93521603,77.6157328,275,"biryani, kebab, north indian",4,200,koramangala 5th block
Biryani By Kilo,12.93727473,77.6244301,311,"biryani, hyderabadi, north indian, kebab, mughlai, desserts",4.2,200,koramangala 6th block
Anand Sweets And Savouries,12.98164454,77.60982279,2109,"mithai, street food, beverages, desserts",4.3,200,commercial street
Goli Vada Pav,12.98587438,77.6713473,0,"street food, burger, fast food, ice cream",3.6,200,kaggadasapura
WarmOven Cake & Desserts,12.98412032,77.678486,5036,"bakery, desserts, ice cream, shake",3.9,200,kaggadasapura
Nagarjuna,12.97321829,77.60932088,2302,"andhra, biryani, north indian",4.3,200,residency road
Kwality WallÅEÄÅEs Frozen Dessert and Ice Cream Shop,12.97304219,77.63519347,127,"ice cream, desserts",4.1,200,indiranagar
EasyBites by Empire,12.96728502,77.60896213,414,"burger, fast food, beverages",4.1,200,brigade road
"Frozen Bottle - Milkshakes, Desserts And Ice Cream",12.95911717,77.65690173,159,"beverages, desserts, ice cream, waffle, bakery, healthy food",4.2,250,old airport road
Amma's Pastries,12.97416055,77.63579294,487,bakery,4.3,250,indiranagar
Narmada Chain of Restaurants,13.00058977,77.61420341,0,"andhra, hyderabadi, biryani, north indian, chinese, beverages",New,250,frazer town
Savoury Restaurant,12.9854415,77.67292276,214,"arabian, mughlai, north indian, chinese, fast food, beverages, shake, desserts",4,250,varsova layout kaggadasapura
Royal Restaurant,12.98572802,77.60525431,225,"north indian, chinese, sichuan",3.9,250,shivajinagar
Bakingo,12.92453709,77.63865922,6420,"bakery, desserts",4.3,250,koramangala 1st block
Vijayalakshmi Veg,13.00091788,77.61280071,97,"south indian, chinese, north indian, sichuan",4,250,frazer town
Rolls On Wheels,12.97155203,77.63579931,84,"north indian, rolls, fast food",4,250,indiranagar
The Pizza Bakery - Brew & Eatery,12.975156,77.604557,172,"pizza, pasta, italian, desserts, continental, beverages",4.1,250,church street
Paratha Envy,12.968187,77.650777,7255,north indian,4.2,250,thippasandra
Moriz Nano Restaurant,12.98757029,77.61894934,215,"north indian, chinese, arabian, mughlai, fast food, beverages, shake",3.5,250,ulsoor
Call Me Chow,13.00781371,77.64398575,2617,"chinese, japanese, thai, indonesian, asian",4.2,250,kalyan nagar
The Punjabi Rasoi,12.9554742,77.7129847,3042,"north indian, chinese, mughlai",4.1,200,brookefield
Barbeque Nation,12.97362,77.62117,1654,"street food, mughlai, biryani, north indian, desserts, beverages, bar food",3.9,200,ulsoor
Chulha Chauki Da Dhaba,12.98185429,77.69270372,3278,"north indian, chinese, kebab, mughlai, biryani, desserts, beverages",4.2,200,marathahalli
The Belgian Waffle Co.,12.93421,77.616449,34,"waffle, pancake, desserts, beverages, ice cream",4.3,200,koramangala 7th block
Baskin Robbins,12.95912327,77.65426196,31,"ice cream, desserts",4.1,200,old airport road
Great Indian Khichdi by EatFit,13.008305,77.651848,356,"healthy food, north indian, ice cream, desserts, beverages",3.7,200,basavanagudi
Anjappar,12.97424582,77.60770451,37,"south indian, chettinad, biryani, seafood, chinese, north indian, desserts, beverages",4,200,brigade road
Glen's Bakehouse,12.93788056,77.62640689,310,"bakery, cafe, italian, continental, fast food, beverages, desserts",4.3,200,koramangala 6th block
New Udupi Garden,12.95670573,77.65364137,61,"south indian, north indian, beverages, chinese",3.7,200,old airport road
LunchBox - Meals and Thalis,12.97135763,77.65835401,377,north indian,3.8,200,thippasandra
Biryani Blues,12.974674,77.605851,234,"biryani, kebab, hyderabadi",4.1,200,church street
Theobroma,12.99867,77.61548,11,"bakery, desserts, beverages",4.3,200,frazer town
Aroma's Hyderabad House,12.948674,77.69888,136,"biryani, mughlai, north indian, chinese, kebab, beverages",3.8,300,marathahalli
Siddique Kabab Centre,12.99346322,77.60852728,553,"mughlai, chinese, north indian, rolls, sichuan",3.9,300,frazer town
Ghee And Turmeric,12.993881,77.663595,248,north indian,4.1,300,cv raman nagar
ZAZA 22 Spice Awadhi Biryani,12.98061,77.64638,792,"biryani, mughlai, north indian",4,300,indiranagar
NH1 Bowls - Highway To North,12.98061,77.64638,518,"north indian, kebab, desserts",4.4,300,indiranagar
New Udupi Grand,12.9679584,77.65246287,14,"south indian, north indian, chinese, street food, beverages, shake",3.9,300,jeevan bhima nagar
WOW! China,12.97500348,77.6048379,26,"chinese, rolls, seafood, desserts, shake, sichuan",3.9,300,church street
The Biryani Life,12.97136122,77.65834395,315,"biryani, kebab, hyderabadi, lucknowi",3.7,300,thippasandra
Samosa Party,12.9587153,77.65475578,1,"street food, beverages",4.2,300,old airport road
7 Plates,12.99708032,77.60389309,3118,"north indian, mughlai, rolls, chinese",4.1,300,frazer town
UBQ By Barbeque Nation,12.97362,77.62117,1371,"north indian, bbq, biryani, kebab",3.6,300,ulsoor
Smoor,12.97344014,77.62022104,556,"bakery, desserts",4.4,300,near mg road
The Dessert Heaven - Pure Veg,13.007994,77.641945,20,"desserts, bakery",3.9,250,banaswadi
Kaati Zone Rolls and Wraps,12.98396448,77.67860804,1393,"rolls, fast food, beverages, wraps, desserts, shake",4,250,kaggadasapura
Chai Point,12.97327286,77.61669226,4611,"tea, beverages, shake, fast food, rolls, desserts, coffee",4,250,mg road
Ludos Pizza,12.968125,77.6507868,570,"pizza, fast food",4.2,250,jeevan bhima nagar
Delicacy,12.99846318,77.61770613,273,"chinese, thai",3.9,250,frazer town
Chinese BAE,12.9677649,77.6545273,526,"chinese, seafood, momos, sichuan",4.1,250,jeevan bhima nagar
Donne Biryani Mane,12.93687673,77.62767591,11,"biryani, south indian",4,250,koramangala 4th block
The Good Bowl,12.97125634,77.65838351,2057,"north indian, pasta, italian",4,250,thippasandra
Momoz,12.9677649,77.6545273,1035,"chinese, momos, burger, sichuan",3.8,250,jeevan bhima nagar
Mealful Rolls - India's Biggest Rolls,12.98061,77.64638,525,"rolls, fast food, north indian, desserts, beverages",4.3,250,indiranagar
Biggies Burger,12.9951881,77.6142152,43,"fast food, burger, beverages",3.9,250,frazer town
99 Variety Dosa & Pav Bhaji,12.93684013,77.62756359,162,"south indian, maharashtrian",3.7,250,koramangala 6th block
Keventers - Milkshakes & Desserts,12.9702092,77.60921158,22,"shake, beverages, ice cream",4.3,250,near brigade road
Mad Over Donuts,12.97050325,77.60930311,159,"desserts, waffle, beverages",4.1,250,brigade road
FB Cakes,12.956512,77.696509,230,bakery,3.8,250,marathahalli
ITC Master Chef Creations,12.99804274,77.62810338,505,"north indian, biryani, mughlai, kebab, rolls, desserts, modern indian",4.1,250,banaswadi
Ambur Biryani Point,12.92773921,77.63736337,22,biryani,4.3,250,koramangala 1st block
Chung Wah,12.97388317,77.60943722,353,"chinese, thai, vietnamese, sichuan",4.1,250,residency road
Donne Biriyani House,13.01081745,77.63507444,2633,"biryani, south indian",3.5,250,kammanahalli
Laddoos,12.967889,77.652837,203,"mithai, north indian, street food",3.9,250,jeevan bhima nagar
Chaayos Chai+Snacks=Relax,12.9795016,77.6580343,397,"tea, beverages",4.2,250,cv raman nagar
Cream Stone Ice Cream,13.0005875,77.6153902,100,"ice cream, desserts, beverages, shake",4,250,frazer town
Cupcake Bliss Cakes & Desserts,12.98409581,77.67850477,1045,"bakery, desserts",4,250,kaggadasapura
Yumlane Pizza,12.96941716,77.68267161,45,"pizza, fast food, desserts, beverages",3.3,250,kaggadasapura
Starbucks Coffee,12.97285074,77.61852052,67,"cafe, beverages, desserts",3.9,300,mg road
Krispy Kreme,12.9669276,77.6115022,60,"desserts, beverages",4.5,300,richmond road
Momo Zone - The Momo Company,12.984222,77.678224,237,"chinese, tibetan",3.9,300,kaggadasapura
Just Shawarma,13.01577362,77.63920739,76,"lebanese, fast food, beverages",3.6,300,kalyan nagar
IDC Kitchen,12.96593989,77.59453185,31,"south indian, beverages",4.1,300,residency road
Donne Biriyani Mane,12.99225217,77.66395178,32,"biryani, south indian, chinese, north indian, seafood",3.2,300,cv raman nagar
Sweet Truth - Cake and Desserts,12.97125961,77.6584043,740,"desserts, bakery",4.1,300,thippasandra
ibaco,12.96772871,77.60663096,107,"ice cream, bakery, desserts",4.4,300,brigade road
Itminaan Matka Biryani - Slow Cooked,12.980606,77.646376,570,"biryani, north indian, desserts",4.2,300,indiranagar
Sreeraj Lassi Bar,12.98266354,77.61078872,181,"beverages, shake, ice cream, desserts",4.3,300,commercial street
Pure Veg Meals By LunchBox,12.95709,77.6626,43,north indian,4,300,old airport road
Hotel Revoli Inn,12.95597678,77.59207126,65,"chinese, north indian, mughlai",4,300,shanti nagar
GOPIZZA,13.0009569,77.6325712,17,"pizza, fast food",3.8,300,banaswadi
Donne Biriyanis Junction,13.01066849,77.63506573,874,"biryani, south indian",3.5,300,kammanahalli
Pasta Street,12.93304603,77.63107996,4060,"pasta, pizza, italian, european, salad, desserts, beverages",4.1,300,koramangala 4th block
New Tandoor,12.98524091,77.66750269,276,"north indian, chinese, mughlai, rolls, biryani, seafood",3.9,300,cv raman nagar
Daily Sushi,12.97579083,77.60248683,55,"japanese, korean, sushi, asian",3.9,300,church street
Dum Biryani Adda,12.96786986,77.65442189,3615,"biryani, north indian",4,300,jeevan bhima nagar
The Filter Coffee,13.01780676,77.64303122,936,"south indian, coffee",4.3,300,kalyan nagar
Zaatar,12.99595105,77.66673524,699,"bbq, arabian, biryani, chinese, north indian, mughlai, desserts, beverages",3.8,300,old madras road
The Dessert Zone,12.984222,77.678224,194,"desserts, bakery",3.7,300,kaggadasapura
Hamza Hotel,12.98604819,77.60495793,308,"north indian, chinese, mughlai, biryani",4.2,300,shivajinagar
AB's - Absolute Barbecues,12.9498712,77.69909033,14867,"north indian, mangalorean, bbq, street food, desserts, salad, beverages",3.6,300,marathahalli
Khan Saheb Grills and Rolls,12.97127921,77.63509657,1058,"north indian, rolls, kebab, mughlai, biryani, beverages",4,300,indiranagar
Toscano,12.9749375,77.6029375,83,"italian, pizza, salad, continental, desserts, beverages, seafood",4,500,church street
Just Bake,12.99625772,77.61357486,15,bakery,3.6,500,frazer town
Bucket Biryani,12.96713211,77.6089846,7,"north indian, biryani, chinese, mughlai",4.1,500,brigade road
Ghee Tadka Khichdi,12.968125,77.6507868,1627,"north indian, street food",4.4,500,jeevan bhima nagar
Apsara Ice Creams,12.98897084,77.66380459,391,"ice cream, desserts",4.2,500,cv raman nagar
New Taj Darbar,12.9853641,77.6052562,64,"north indian, chinese, mughlai, biryani",3.6,500,shivajinagar
Aubree,12.97290301,77.61848833,30,"bakery, fast food, italian, thai, desserts",4.2,500,mg road
Absolute Shawarma,12.97223683,77.65378989,54,"lebanese, rolls",3.8,500,thippasandra
Suchithra Biryani House,12.95907295,77.65509512,360,"biryani, north indian, chinese, seafood, mughlai",4.1,500,old airport road
1522 - The Pub,12.97306539,77.60894537,108,"chinese, north indian, continental, finger food, seafood, beverages",4.3,500,residency road
RS Shiv Sagar,12.97449707,77.61002932,344,"north indian, south indian, asian, continental, chinese, beverages, desserts",3.8,500,mg road
Chopstick,12.9677649,77.6545273,688,"chinese, sichuan",3.7,500,jeevan bhima nagar
Mainland China,12.97521551,77.60392025,2360,"chinese, asian, sushi, momos, japanese, thai, beverages",4.2,500,church street
Aligarh House by EatFit,13.0084027,77.65178159,321,"biryani, north indian, kebab, desserts, beverages",3.6,500,banaswadi
Sangam Sweets,13.01899329,77.64292831,1,"mithai, fast food, street food, beverages",4,500,kalyan nagar
Hotel Fanoos,12.96475091,77.60647767,847,"rolls, biryani, fast food, arabian",4.3,500,richmond road
Brik Oven,12.97486037,77.60533679,2837,"cafe, italian, fast food, beverages, waffle, desserts",4.1,500,church street
Chaatimes,12.97481039,77.60834724,1335,"street food, fast food",4.1,500,brigade road
Sendhoor Coffee,12.97053429,77.63336559,171,"south indian, beverages",3.7,500,indiranagar
Shiv Sagar,13.00214294,77.63314325,5,"south indian, north indian, oriental, street food, desserts, beverages, shake",3.7,500,banaswadi
Magnolia Bakery,12.99790063,77.69656576,1674,"bakery, desserts",4.2,500,kr puram
Empire Juices and Desserts,12.96717361,77.60895509,781,"juices, beverages, shake, ice cream",4.5,500,brigade road
Bangarpet Chats,13.002592,77.66766,1,street food,3.9,500,old madras road
The Thick Shake Factory,12.99147265,77.61156757,7,"ice cream, shake, desserts, tea, beverages",3.7,500,frazer town
Motis Kitchen,12.97254427,77.65337247,499,"south indian, kerala, chinese, seafood, chettinad",4.2,150,thippasandra
Sri Srinivas Pork Hotel,12.94867695,77.62745127,41,fast food,3.3,150,ejipura
NOTO - Healthy Ice Cream,12.97309344,77.60917078,16,"ice cream, mithai, desserts",3.7,150,brigade road
Tomba Kitchens,12.95036853,77.62522638,79,"naga, chinese, beverages",4.3,150,ejipura
Cafe Coffee Day,12.97052,77.60996,27,"cafe, fast food, coffee, desserts, beverages",4,150,ground floor garuda mall brigade road
Momo Monk,12.968187,77.650777,723,momos,4.1,150,jeevan bhima nagar
Rahhams,13.00090939,77.61313699,1032,"biryani, mughlai, north indian, kebab, chinese",4.1,150,frazer town
Le Arabia,12.933545,77.6227283,72,"arabian, north indian, chinese, fast food, beverages, desserts",3.5,150,koramangala 5th block
Bombay Kulfi,12.93716429,77.62471676,0,desserts,New,150,koramangala 6th block
Indiana Burgers,12.98393181,77.67857652,2161,"burger, rolls, beverages, desserts, shake",3.9,150,kaggadasapura
CrustoÅEÄÅEs - Cheese Burst Pizza,12.94041178,77.62519659,18,pizza,3.8,150,koramangala 6th block
Chichaba's Taj,13.00035697,77.61733733,553,"north indian, mughlai, biryani, kebab, seafood, beverages",4,150,frazer town
Goila Butter Chicken,12.93727473,77.6244301,123,"north indian, mughlai, biryani, rolls",4.1,350,koramangala 6th block
Sukh Sagar,12.93333064,77.62315605,520,"south indian, north indian, chinese, street food, ice cream, desserts, beverages",4.1,350,koramangala 5th block
Chaitra Restaurant,13.01309498,77.64244784,64,"north indian, chinese, andhra, biryani, seafood, fast food, south indian",3.6,350,kalyan nagar
Sichuan,12.96799929,77.65310442,1208,"chinese, asian, thai, momos, sichuan",4,350,jeevan bhima nagar
Third Wave Coffee,12.9745178,77.6068982,399,"cafe, coffee, fast food, beverages",4.2,350,church street
Tharavadu,12.9371584,77.61963833,5,"kerala, biryani, chinese, sichuan",3.6,350,koramangala 5th block
Shanthi Sagar,12.98717857,77.61890743,211,"south indian, north indian, chinese, street food, desserts, shake, beverages",4,350,ulsoor
Juice Junction,12.9721019,77.6012196,124,"juices, beverages, sandwich, fast food, shake, rolls, healthy food, street food",4.3,350,st. marks road
TrueCakes,13.01441405,77.63561927,154,bakery,3.7,350,kammanahalli
Kolkata Famous Kati Roll,12.969265,77.6825825,11,rolls,4,350,kaggadasapura
Home Plate by EatFit,13.008305,77.651848,90,"north indian, beverages",3.8,350,banaswadi
Lassi Corner,12.94445759,77.61735309,1,"beverages, fast food, desserts, shake",3.8,350,koramangala 8th block
Oh! Calcutta,12.9752165,77.60390013,1681,"bengali, north indian, seafood, mughlai",4.1,400,church street
Richie Rich,12.98683423,77.58000903,756,"desserts, beverages, fast food, ice cream, shake",4.3,400,race course road
Calcutta Victoria Chat House,13.00128344,77.66169537,173,"north indian, street food, desserts, beverages",3.8,400,banaswadi
Mother's Meal,12.98149785,77.66686767,162,"north indian, chinese",4.3,400,cv raman nagar
Big Bang Pizza,12.9948082,77.61502594,92,"pizza, fast food, burger, beverages",4,400,frazer town
Sattvam,12.993855,77.700745,583,"north indian, south indian",3.9,400,whitefield
Al Taza,12.93076712,77.6329555,33,lebanese,4.3,400,koramangala 1st block
Green Onion,12.9734091,77.6092974,1369,"chinese, seafood, sichuan",4.2,400,residency road
Karavali Family Restaurant,12.9729775,77.60928199,28,"mangalorean, biryani, chinese, south indian",3.9,400,brigade road
Main Lassi Shop,12.9851821,77.60358933,7957,"beverages, ice cream, juices, fast food, street food, sandwich, shake",3.8,400,shivajinagar
Haka,12.97522434,77.60392327,362,"chinese, momos",4.1,400,church street
Firangi Bake,12.9712619,77.65841637,1445,"italian, mexican",3.9,400,thippasandra
Chung's Chinese Corner,12.98909499,77.59394813,244,"chinese, asian, seafood, thai, sichuan",3.7,300,cunningham road
Snack House,12.994739,77.61505,502,"fast food, momos",3.7,300,frazer town
Kulfi Shulfi- Kulfis and¬†Ice Cream,12.98453752,77.67565124,4,"ice cream, desserts",4.3,300,cv raman nagar
Fresh Bites,13.00927851,77.64967304,261,"north indian, chinese",3.7,300,banaswadi
Cake Menu,12.957084,77.702718,2416,bakery,3.6,300,marathahalli
SLAY Coffee,12.95704326,77.66238168,575,coffee,4,300,old airport road
Taj Hotel,12.98534251,77.6072016,171,"chinese, south indian, north indian, mughlai",3.8,300,shivajinagar
Burger Seigneur,12.97504236,77.60257144,184,"cafe, burger, continental, beverages, desserts",4.2,300,st. marks road
Tapri By The Corner,12.93556934,77.62117088,177,"north indian, chinese",3.9,300,koramangala 5th block
Hotel Navayuga,12.97665502,77.57567089,281,"andhra, biryani",4.3,300,majestic
Dum Safar Biryani,12.9255192,77.6369965,79,"biryani, kebab, north indian, bbq, desserts, beverages",4.3,300,koramangala 1st block
Gramin,12.93469099,77.61329323,3662,"north indian, healthy food, beverages, shake",4.1,300,koramangala 7th block
Sri Murugan Cafe,12.99276671,77.66391121,11,"south indian, chinese, beverages",4,100,cv raman nagar
Habibi Falafel,13.01421086,77.6370576,13,"arabian, fast food, beverages, desserts",4.2,100,kammanahalli
Delhi Food Point,12.92719414,77.63774291,525,"north indian, beverages",3.6,100,koramangala 1st block
Sree Krishna Kafe,12.93711429,77.6194375,958,"south indian, beverages",4.2,100,koramangala 5th block
FB Caf√©¬†By¬†Frozen Bottle,12.95911717,77.65690173,12,bakery,3.6,100,old airport road
Al Zara Mandi Arabian Restaurant,13.00073984,77.61436176,76,"arabian, north indian, mughlai",4,100,frazer town
Say Cheese Cake,12.93709599,77.62468793,2497,"bakery, desserts, shake",4.2,100,koramangala 6th block
Maharaja Military Canteen,12.98504075,77.59636158,66,south indian,3.6,100,cunningham road
Hotel Salala,12.95896872,77.65535731,100,"north indian, south indian, chinese, mughlai",3.8,100,old airport road
Tandoori Taal,12.98581852,77.58769054,84,"north indian, seafood, desserts",4,100,race course road
Namma Madurai,12.97165298,77.65077475,62,south indian,4.2,100,thippasandra
Swiss Cream,12.99435901,77.66663264,114,"ice cream, waffle, desserts, sandwich, shake, beverages",4,100,old madras road
Sindhoora Gardenia,12.993883,77.7012517,0,"andhra, north indian, mughlai, chinese, seafood, biryani, beverages, desserts",New,300,kr puram
