name,lat,long,review,cusine,num_rate,cost_one,Location
New Spice Tandoori,12.99197971,77.53649488,11,"chinese, north indian, south indian, andhra",4.3,150,basaveshwara nagar
Thali 99,13.02531643,77.59040498,110,"north indian, mughlai",3.4,300,rt nagar
KC Das - Sweet House,13.0276057,77.5764494,44,"mithai, street food, mishti, bengali",3.5,300,sanjay nagar
Hao Chi,13.03535951,77.56772015,3421,"vietnamese, chinese, sichuan",3.7,300,new bel road
Pot Biryani,13.03001797,77.56281104,120,"north indian, chinese, biryani, seafood, kebab, hyderabadi",3.5,300,new bel road
Samosa Singh,13.03238155,77.59405676,502,"street food, fast food, tea, north indian",3.4,300,rt nagar
New Kadai Family Restaurant,13.018219,77.59199515,8,"chinese, kebab, south indian, north indian, fast food, beverages, desserts, shake",3.9,300,rt nagar
Barley & Grapes Cafe,13.06380138,77.59010285,653,"italian, continental, fast food, street food, ice cream, desserts",3.9,300,sahakara nagar
ITC Sunfeast Baked Creations,12.9834901,77.54881427,176,"bakery, desserts, , cafe, continental, sandwich",4.3,300,rajajinagar
HomeSe Just Veg,12.97377633,77.57928584,881,"south indian, north indian",3.9,300,majestic
Taiki,13.03921085,77.56399289,318,"japanese, korean, asian, sushi",4,300,new bel road
The Brooklyn Creamery - Healthy Ice Cream,12.98927173,77.57205896,100,ice cream,4.2,200,seshadripuram
Basaveshwarnagar Dosa Corner,12.99113978,77.54151497,121,south indian,4.1,200,basaveshwara nagar
Donne Biriyani Mane,13.02755213,77.5383684,6,"north indian, biryani",3.7,200,yeshwantpur
Food Court By Kitchens@,12.98348586,77.54882231,82,"north indian, south indian, chinese, mughlai, biryani, momos, desserts, beverages",3.3,200,rajajinagar
Grow Fit,13.02723561,77.57178806,480,"healthy food, desserts, beverages",3.6,200,sanjay nagar
Halli Mane Donne Biriyani,13.00089567,77.55306657,157,"north indian, biryani",4.1,200,rajajinagar
Roll N Roll,13.03003888,77.56278254,4915,rolls,4.1,200,yeshwantpur
Joy's Kuttanadu Restaurant,13.02833935,77.56173983,38,"kerala, seafood, fast food",3.9,200,yeshwantpur
Simply Chats,12.9998431,77.539967,0,"street food, sandwich, ice cream, beverages",3.6,200,basaveshwara nagar
Rollsking,13.0389898,77.5641592,87,"rolls, fast food, north indian",4.2,200,new bel road
Karnataka Chicken Biryani Point,12.98995714,77.5456848,4,"biryani, kebab, chinese, south indian, sichuan",3.4,200,basaveshwara nagar
Curryce Andhra Bhojanam,13.01727953,77.5917846,10,"andhra, south indian",3.9,200,rt nagar
Rich Grills Restaurant,13.01467277,77.5440748,99,"street food, arabian, north indian, mughlai, seafood, ice cream, desserts, beverages",3.7,200,yeshwantpur
Nammur Donne Biryani,13.0016441,77.59486645,274,"biryani, south indian",4.3,200,frazer town
Sri Durga Chats & Juice,12.97248416,77.53884517,139,"fast food, street food, beverages, desserts",4.2,200,vijay nagar
The Betel Leaf Co - Originally from Bangalore,12.9925831,77.5778683,507,"paan, desserts",4.6,200,seshadripuram
GFC Biryani,13.0268126,77.58683424,6,"biryani, north indian",3.4,200,rt nagar
Tasty Paradise,12.98995812,77.57276203,54,"north indian, mughlai, chinese, sichuan, beverages",4.2,200,malleshwaram
Vinny,13.03286825,77.56935932,1349,"cafe, continental, italian, pizza, burger, beverages, desserts",3.9,200,new bel road
Taste Of Malabar,13.02998498,77.56252773,159,"kerala, north indian, chinese, mughlai, arabian, shake, sichuan",3.5,200,new bel road
Kadai,12.99740864,77.54534449,90,"north indian, chinese, south indian, seafood, andhra, biryani",3.9,200,basaveshwara nagar
A1 Biryani Combo 75,13.00819298,77.57067394,919,"biryani, kebab, south indian",3.5,200,malleshwaram
The Druid Garden,13.06347511,77.59123541,5016,"north indian, continental, italian, mughlai, finger food, beverages, desserts",3.9,200,sahakara nagar
New Prashanth Hotel,12.99852068,77.55093455,23,"south indian, biryani",4.3,200,rajajinagar
Jay Jagannath Bengali Mess,13.02947248,77.56196514,23,"north indian, chinese",3.6,200,yeshwantpur
Gullu's Chat,12.99249882,77.57832259,589,"fast food, street food, sandwich, pizza, desserts, beverages",3.8,200,seshadripuram
Paris Restaurant,13.01976507,77.55537663,67,"north indian, chinese, biryani, seafood, mughlai",3.9,200,yeshwantpur
Chicken House,13.02333106,77.59239479,257,"rolls, chinese, north indian, seafood, mughlai, biryani",3.9,200,rt nagar
Go Naati,12.98997674,77.55281813,28,"south indian, biryani, chinese",3.9,200,rajajinagar
Happy Platter,12.99608785,77.55461622,117,"chinese, north indian, rolls, fast food",4,200,rajajinagar
Abubakar Siddiq Hotel,12.9962427,77.56855264,334,"chinese, rolls, south indian, mughlai, north indian",4.2,100,malleshwaram
Punyashree Hotel,12.9726008,77.53876906,221,"mughlai, south indian",4.2,100,vijay nagar
Gulbarga Refreshment,12.99305877,77.5550618,30,south indian,4.1,100,rajajinagar
Elevate58,12.9944684,77.5223161,57,"chinese, north indian, arabian, biryani, sichuan",3.6,100,basaveshwara nagar
Mystique Palate,13.00407916,77.5538015,13,"chinese, fast food, sichuan",4.2,100,rajajinagar
Smoky Docky,13.0281637,77.5726987,277,"lebanese, beverages",3.9,100,sanjay nagar
Express By ABs,13.02545603,77.54783224,361,"north indian, biryani, bbq",3.6,100,yeshwantpur
New Sukhi Sagar,13.00117335,77.53626455,450,"south indian, chinese, north indian, beverages, desserts",4.1,100,basaveshwara nagar
Tango Sandwich King,12.98794207,77.5379426,31,"fast food, sandwich",4.3,100,basaveshwara nagar
Kunafa World,13.02828284,77.57167406,19,desserts,4.2,150,sanjay nagar
New BEL Prashanth Naati Style,13.03408563,77.56796625,345,"south indian, biryani, mughlai, north indian",4.1,150,new bel road
Suguna Kabab Corner,12.969099,77.54434772,6,"biryani, andhra",4.4,150,vijay nagar
Raj Donne Biriyani Mane,12.99712181,77.54714426,66,"south indian, biryani",4.3,150,rajajinagar
Kolkata No.1 Katti Rolls,13.0479102,77.57496814,7,"rolls, momos",4.1,150,hebbal
Coastal Biryani Paradise,13.02666365,77.58726474,189,"north indian, chinese, biryani, mughlai, seafood, fast food, beverages",4.1,150,rt nagar
Stories Bar & Kitchen,13.00852357,77.54921123,7476,"bar food, chinese, biryani, north indian, italian, bbq, desserts",3.9,150,rajajinagar
Happy Belly Bakes,12.99616331,77.60446407,877,"bakery, desserts, cafe, beverages",4.6,150,frazer town
Chinita Real Mexican Food,12.981014,77.6371498,2854,"mexican, salad, beverages, desserts",4.3,150,indiranagar
Plan B,13.02829623,77.57233657,745,"american, continental, mexican, pizza, burger",4.3,150,near new bel road
Naidu's Sakath Utta,12.99739361,77.54818797,88,"chinese, south indian",3.9,150,rajajinagar
Bengaluru Donne Biriyani Katte,12.976075,77.5757098,5,south indian,4.3,150,majestic
Tandoori Ghar,13.03509657,77.60117602,198,"north indian, chinese, mughlai, kebab, sichuan",3.7,100,rt nagar
Savji's Roll 'N' Biryani,12.97159548,77.54694175,326,"north indian, chinese, south indian, rolls, biryani, sandwich, burger, fast food",3.9,100,vijay nagar
Ganesh Food Joint,13.00339902,77.56526224,57,"south indian, north indian, chinese, fast food, desserts, beverages",3.8,100,malleshwaram
Uncle Tom's Cafe,12.98683194,77.53997471,680,north indian,3.7,100,basaveshwara nagar
Gundappa Donne Biryani,12.99787286,77.58121636,222,"biryani, south indian",3.7,100,seshadripuram
Pizza Plutos,13.037825,77.5654363,451,"fast food, burger, sandwich, shake, juices",3.9,100,new bel road
Pizza Stop,13.00736225,77.56423429,47,"pasta, pizza, fast food",4,100,malleshwaram
Curry Village Restaurant & Cafe,13.0338141,77.5680502,7,"chinese, north indian, biryani, shawarma, mughlai, fast food, arabian, beverages",New,100,sanjay nagar
"Crisp "" N"" Joy",13.0278296,77.5578881,51,"rolls, pizza, fast food",3.9,100,yeshwantpur
South Ruchis,12.97850879,77.54244704,333,"south indian, north indian, chinese, fast food, beverages, desserts",3.9,50,vijay nagar
Basaveshwar Khanavali,12.98011326,77.57560283,29,south indian,4.2,50,majestic
Udupi Kitchen,13.03609967,77.59503644,5,"south indian, chinese, north indian",4.1,50,hebbal
Sirimane Family Restaurant,12.9884958,77.5346244,5,"north indian, chinese, biryani, mughlai, street food, fast food",3.8,50,basaveshwara nagar
Sri Durga Chats & Ice Cream Parlor,12.97254591,77.53892496,322,"fast food, street food, desserts",4.2,50,vijay nagar
Shafiz Lajawaab,13.0149864,77.5927637,149,"north indian, chinese, south indian, sichuan, mughlai",4.1,50,rt nagar
Udupi Upachara,12.9754962,77.5561538,64,"south indian, north indian, chinese",3.9,50,rajajinagar
Bangarpete Chats,13.00664553,77.5411626,398,street food,3.7,50,basaveshwara nagar
Artinci - Indulge Guilt Free!,13.0271398,77.5610604,126,"desserts, ice cream, bakery",4.1,50,yeshwantpur
KFDC Mathsya Darshini,13.00599179,77.54151998,1,"mangalorean, seafood",4.2,50,rajajinagar
Street Foods By Punjab Grill,12.9916638,77.57095858,10,"north indian, street food, biryani, fast food, rolls, beverages",3.2,300,malleshwaram
Mamagoto,12.97027487,77.63918325,2928,"asian, chinese, sushi, thai",4.1,300,indiranagar
MISU,12.985855,77.587701,343,"asian, japanese, thai, burmese, korean, indonesian, vietnamese, singaporean",4.1,300,seshadripuram
Ambara Andhra Restaurant,13.04681406,77.50753809,114,"biryani, south indian, north indian, chinese, sichuan",4,300,peenya
Cake Pastries,12.99878203,77.55078971,468,bakery,3.9,300,rajajinagar
The Higher Taste,13.00929425,77.55133632,980,"south indian, north indian, biryani, fast food, chinese, continental, desserts, beverages",4.2,300,rajajinagar
Paradise Cafe,13.01530453,77.52925359,62,"fast food, pizza, burger, sandwich, shake",3.7,300,peenya
Paratha Box by EatFit,12.999773,77.552474,252,"north indian, desserts, beverages",4,300,rajajinagar
Puliyogare Palace,13.036586,77.556441,11,"south indian, desserts",2.9,300,yeshwantpur
MH 12 Pav Bhaji,13.028047,77.57932674,13,"street food, fast food, beverages",4.1,200,sanjay nagar
Donne Biryani,13.02385,77.592798,110,"biryani, south indian",3.5,200,rt nagar
Donne Biriyani House,12.97962026,77.55371936,74,"biryani, south indian",3.3,200,rajajinagar
Donne Biriyani Angadi Mane,12.98987,77.55326,98,"south indian, biryani",4,200,rajajinagar
Kadegowda Military Hotel,12.98604656,77.54215568,14,"north indian, kerala, mughlai, biryani",4.1,200,basaveshwara nagar
Nando's,13.01131758,77.55501051,4721,"burger, fast food, portuguese",4.2,200,rajajinagar
New Karavali Mess,12.98434901,77.54868351,8,"mangalorean, konkan",3.6,200,rajajinagar
Halal Pizza,13.024442,77.5962072,23,"pizza, fast food",4,200,rt nagar
Sundae Everyday Ice Creams,12.99228811,77.59455767,78,"beverages, ice cream, desserts",3.3,200,vasanth nagar
HRX by EatFit,12.99986949,77.55252144,27,"healthy food, beverages, mediterranean, burger, desserts, wraps, pizza, salad",3.9,200,rajajinagar
Maravanthe,12.9784827,77.63743953,972,"seafood, mangalorean, north indian, chinese, kerala, desserts, beverages",4.2,250,indiranagar
Nirula's,12.99455935,77.59374898,14,ice cream,3.7,250,vasanth nagar
Shree Sagar,13.0080403,77.5710146,56,"south indian, north indian, chinese, beverages",3.7,250,malleshwaram
Davanagere Butter Dosa Corner,12.99596632,77.53056351,120,south indian,4.1,250,basaveshwara nagar
Biryani Hunter,13.0377085,77.5656208,69,"biryani, north indian, chinese",4,250,sanjay nagar
Fabelle Chocolates - ITC Windsor,12.99458994,77.58627235,72,"bakery, desserts, beverages, ice cream, mithai, juices, bengali",4.3,250,near sankey road
8055 - The Restaurant,13.034374,77.5686549,714,"fast food, burger, salad",4.3,250,new bel road
Burger Elite,12.99898,77.54979,32,"burger, fast food",4.1,250,rajajinagar
Cafe Coco,13.032934,77.567294,7,"north indian, chinese, sichuan, beverages, mughlai, fast food, biryani",3.9,250,sanjay nagar
Cake & Bake,13.03629402,77.54912574,173,"bakery, desserts",3.9,250,jalahalli
The Delhi Ritual,13.0022429,77.55272895,136,"north indian, chinese, fast food, desserts, beverages",3.8,350,rajajinagar
The Light House Restaurant,13.02831648,77.57219274,243,"north indian, chinese, seafood, desserts, beverages",4.1,350,new bel road
Bangalore Kabab Centre,13.02128304,77.60612905,83,"north indian, chinese, kebab, rolls",4,350,rt nagar
Hotel Savajis,13.0000953,77.55251203,49,"south indian, north indian",4,350,rajajinagar
Vinaya Cafe,13.02852161,77.54356384,14,"biryani, north indian, south indian, fast food, chinese",4.1,350,yeshwantpur
Kudla Beach,12.99032859,77.55835455,109,"chinese, north indian, mangalorean",4,350,rajajinagar
Grub Monkeys,13.0291602,77.57104609,62,"wraps, burger, hot dogs, fast food, street food, shake, beverages",4.1,350,new bel road
Wat-a-Burger! India Ka Burger,13.0289479,77.5712389,22,"burger, shake",3.8,350,sanjay nagar
Roti Curry & Co,13.02531643,77.59040498,32,"north indian, desserts",3.3,350,rt nagar
Dock Frost'd,12.9834741,77.54881058,102,"desserts, ice cream, beverages",4.3,350,rajajinagar
Bowl Soul,12.9928398,77.5563812,25,"fast food, beverages",3.3,350,rajajinagar
Rasapaka,12.97945363,77.57705525,96,"north indian, south indian, chinese, beverages",4.2,350,majestic
The Sugar Free Keto Kafe - By Artinci,13.0271398,77.5610604,56,"desserts, ice cream, bakery",4,350,yeshwantpur
Mamma Rotti Family Restaurant,13.04166776,77.54686933,83,"mughlai, chinese, north indian, rolls, kebab, sichuan",3.4,350,jalahalli
The Home Food,13.03043,77.600532,289,north indian,4,350,rt nagar
Sri Ram Bhojanalay,13.03083719,77.56225582,627,"north indian, biryani, chinese, beverages",3.8,350,yeshwantpur
Ayodhya Aahar,13.02727088,77.57674344,16,"south indian, north indian, chinese",4.1,350,new bel road
Mandarin By Sabroso,13.03333785,77.56568356,252,"chinese, sichuan",4.1,350,sanjay nagar
Winners Pizza - Fresh Dough,13.03790814,77.56854015,11,"pizza, italian, desserts, beverages",3.3,200,new bel road
Nisarga Grand,13.0265008,77.587623,163,"south indian, chinese, north indian, beverages, sichuan",4.3,200,rt nagar
Drunken Monkey,12.9897935,77.5556783,23,beverages,4.1,200,rajajinagar
Tharavadu Malabar Biryani,13.03911287,77.56410789,655,"kerala, biryani, south indian, north indian, desserts, beverages",3.6,200,new bel road
Crepito,12.99746973,77.54508164,153,"pizza, burger, sandwich, fast food, chinese, street food, beverages, desserts",4,200,rajajinagar
Esplanade,12.97867312,77.63657548,1900,"bengali, mughlai, seafood, desserts",4.2,200,indiranagar
New Punjabi Dhaba,13.03256937,77.5666694,181,"north indian, chinese, beverages",4.2,200,yeshwantpur
New A1 Chicken Biryani Point,12.9902257,77.5458035,28,"biryani, chinese",4.1,200,rajajinagar
Kolkata Famous Kati Rolls,13.02789511,77.60439064,1314,rolls,3.9,200,rt nagar
Hotel New Panchavati,12.9727354,77.53793154,81,"north indian, chinese, biryani, south indian, mughlai, bbq, bengali, sichuan",3.7,200,vijay nagar
Connie's Restaurant & Steakhouse,13.01491951,77.63306628,1573,"steak, continental, italian, american, burger, desserts, beverages",4.1,200,kammanahalli
Royal Garden Family Restaurant,13.03594811,77.5252068,87,"chinese, mughlai, north indian, biryani",3.9,150,peenya
Om Sai Ram Food Junction,13.03093029,77.56219547,1332,"north indian, chinese, biryani",3.7,150,new bel road
Mint Masala,13.00685133,77.57880338,639,"chinese, north indian, desserts, beverages",4.1,150,sadashiv nagar
The Taste Hub,13.0229853,77.5922941,61,"fast food, biryani, lebanese, beverages",3.5,150,rt nagar
Jaggery Cafe,13.03068269,77.55980562,75,"healthy food, momos, sandwich, fast food, beverages",3.7,150,yeshwantpur
Slay Coffee Bar,12.97142,77.6007013,7,coffee,4.6,150,st. marks road
ATH - All Things Healthy!,13.03715315,77.56479209,218,healthy food,4,150,sanjay nagar
Rice Sambar,13.01934075,77.56181158,11,"rolls, south indian, momos",2.9,150,yeshwantpur
Cold Stone Creamery,12.981508,77.563192,36,"ice cream, desserts, waffle, beverages, shake",4,150,rajajinagar
Amogha Sagar Grand,12.98693747,77.53993113,10,"south indian, chinese, fast food, shake, beverages",4,150,basaveshwara nagar
Udupi Ruchi,12.98584988,77.55230214,86,"south indian, north indian, chinese, street food, beverages, shake, sichuan",4,150,rajajinagar
PVR Caf√©,13.01077172,77.55501587,41,"burger, sandwich, fast food",3.2,150,malleshwaram
Veg Daawat By Behrouz,12.9896094,77.5721166,17,"biryani, mughlai, north indian",4,500,seshadripuram
Cool City,13.01942,77.561895,4117,"north indian, chinese, rolls, beverages",3.1,500,malleshwaram
Pulusu,13.03586482,77.56689437,169,"andhra, south indian, biryani",3.7,500,new bel road
Sikandar,12.97554354,77.60584977,259,"rolls, kebab, north indian, desserts",4.6,500,mg road
Appu Biryani Centre,13.002017,77.525514,0,"biryani, south indian, north indian",-,500,near basaveshwara nagar
Garden Kabab Corner,13.01907615,77.55743623,26,"mughlai, north indian, seafood, kebab",3.6,500,yeshwantpur
Hotel Chandrika,12.9906549,77.5929618,241,"south indian, north indian, chinese, street food, fast food, biryani, desserts, beverages",4.1,500,cunningham road
Hotel Nalapaka,12.99843052,77.5522951,870,"south indian, beverages",4.1,500,rajajinagar
3 Mangos,12.9992207,77.6156156,404,"ice cream, desserts, shake",4.1,500,frazer town
Hatch,12.99380984,77.57149972,553,"south indian, mangalorean, seafood, beverages, chinese, continental, biryani, bar food",3.7,500,malleshwaram
Kutumba Kitchen,13.0344871,77.56888964,136,"biryani, south indian",4.3,300,new bel road
Bong Connection,13.03010094,77.56247073,51,"chinese, north indian, bengali, sichuan",4.1,300,yeshwantpur
Signature Wraps & Rolls By Faasos,13.0033,77.5585,0,"rolls, wraps",-,300,malleshwaram
House of Mughals,12.983541,77.548758,12,"mughlai, biryani, kebab, north indian, bbq, desserts",3.5,300,rajajinagar
Fish Land KSCFF,13.01208525,77.53577504,6,"seafood, south indian",3.8,300,rajajinagar
Chin Lung Resto Bar,13.03001111,77.5705529,823,"bar food, chinese, north indian",4.1,300,new bel road
Maarish Food Joint,13.01717304,77.531625,559,"chinese, north indian, sichuan",3.9,300,rajajinagar
Kolkata Victoria Chat House,13.02498859,77.59265542,98,"street food, south indian",4.1,300,rt nagar
Boobacha,13.0014654,77.5810154,69,"bubble tea, shake, waffle",3.6,300,sankey road
Fit Feast,13.025871,77.561251,2753,"salad, healthy food, continental, rolls",4,300,yeshwantpur
Sangam House Of Kebabs,12.96442811,77.55462527,43,"biryani, chinese, north indian, mughlai",4,300,vijay nagar
Grand Foodies Restaurant,12.99258964,77.59219263,43,"biryani, chinese, kebab, rolls",3.9,100,vasanth nagar
Pizza Brew House,13.03007317,77.57062498,209,"pizza, fast food",3.9,100,new bel road
Shyam Mishra Juice Centre,12.97063,77.5781,134,"beverages, juices",4.1,100,majestic
Midnight Eats,12.9859546,77.6050501,2643,"rolls, north indian, chinese, beverages, sichuan",4,100,shivajinagar
Trattoria By Toscano,12.9749375,77.6029375,8,"italian, continental, healthy food, desserts, salad, shake, seafood",4,100,church street
Happy Hours,12.98711291,77.57859651,53,"south indian, sandwich, pizza, fast food, shake, juices",4,100,seshadripuram
Lassi 'n' Mock,13.0281861,77.5726316,83,"desserts, beverages, ice cream, sandwich, salad, shake, juices, healthy food",4,100,sanjay nagar
Baf's Cafe,12.99811102,77.54077837,55,"chinese, juices, fast food, momos, north indian, desserts, beverages",4,100,basaveshwara nagar
Nizam's Kitchens,13.03917395,77.56407201,381,"biryani, mughlai, andhra, hyderabadi, south indian, north indian",3.3,150,new bel road
MM Prashanth Hotel,13.00808649,77.55481604,64,"biryani, south indian, north indian, street food",4,150,rajajinagar
Queens Restaurant,13.02863104,77.57194899,16,"north indian, fast food, street food, desserts, beverages",4.3,150,new bel road
New Govind Rao Military Hotel,12.97276318,77.57022366,158,"south indian, mughlai",3.8,150,majestic
22 Se Srabon,13.041049,77.5541761,246,"bengali, north indian",3.9,150,new bel road
LM Paradise Cuisines And Cafe,13.03404251,77.59678926,170,"north indian, mughlai, chinese, sichuan",3.4,150,rt nagar
A1 Ambur Chicken Biriyani Point,13.01929077,77.55793646,583,"biryani, tamil, kebab",3.5,150,yeshwantpur
Royal Savera Family Restaurant,13.00067581,77.61529852,60,"north indian, mughlai, chinese, rolls",4.1,150,frazer town
Papa Roll's,13.01940248,77.56187294,1819,"fast food, chinese, north indian, street food, beverages, rolls, momos",3.3,150,yeshwantpur
Lakshmi Juice Centre,12.98987258,77.57403703,182,"beverages, juices, ice cream, shake",4.4,150,seshadripuram
Holy Doh!,12.96922446,77.60641471,235,"pizza, sandwich",4,150,brigade road
GFC Biryani,13.0297735,77.578168,0,"biryani, kebab",4.1,100,sanjay nagar
Bowl 99,13.036586,77.556441,30,"north indian, desserts",3.3,100,yeshwantpur
V Cafe- Meals By PVR,13.01084979,77.55497664,90,"burger, sandwich, fast food",3.3,100,malleshwaram
Fat Cat Pizza Company,12.9790063,77.6331316,225,pizza,4.3,100,indiranagar
Asia Seven,12.991711,77.570636,0,"chinese, momos, asian, sichuan, thai, beverages",4,100,malleshwaram
Candice's Gourmet Sandwiches,12.98108783,77.63718165,592,"sandwich, salad, american, beverages, desserts",4.1,100,indiranagar
Mane Holige Kuruku Thindi,12.99930244,77.57253136,54,mithai,4,100,malleshwaram
Bombay Kulfi &  Rabri,12.9572709,77.5872362,214,ice cream,4.4,100,shanti nagar
Dil Tiffins,12.975115,77.578706,18,"south indian, beverages",3.8,100,majestic
Green Cravings,12.9928398,77.5563812,26,"healthy food, continental",3.6,100,rajajinagar
Ambur Biriyani House,13.02088747,77.5584843,173,biryani,4.1,100,yeshwantpur
Khichdi Kahani,12.963444,77.567153,6,"desserts, healthy food",3.3,300,basavanagudi
Edesia by Freshmenu,12.99257364,77.55674925,283,"bakery, desserts",3.9,300,rajajinagar
Ice Fort,12.98673622,77.53992442,58,"ice cream, desserts, beverages, shake, sandwich",4.5,300,basaveshwara nagar
Sree Ganesha Fruit Juice Centre,12.99548315,77.61400938,0,"beverages, juices, shake",-,300,frazer town
Delhi Dhaba,13.0341113,77.5966914,280,"north indian, chinese, mughlai, sichuan",3.7,300,rt nagar
The Happy Fields Kitchen,13.03983354,77.5525975,94,"andhra, chinese",4.3,300,new bel road
Annapoorneswari Dose Corner,12.99106515,77.54079076,37,south indian,3.7,300,basaveshwara nagar
Armani Kitchen,13.01820561,77.59202801,514,"chinese, north indian, rolls, lebanese, biryani, sichuan",4.2,300,rt nagar
Thin Tony's Pizza,12.9701936,77.639017,40,"pizza, italian, american, beverages",4.1,300,indiranagar
The Celebration Cakes And Desserts,13.03316,77.566121,45,bakery,4,300,malleshwaram
Charminar Kabab Paradise,13.00051084,77.61504605,151,"north indian, chinese, rolls",3.8,300,frazer town
Protein Chef,13.03715315,77.56479209,29,"north indian, healthy food",3.5,300,sanjay nagar
Starboy Pizza & Shakes,13.03790814,77.56854015,38,"pizza, italian, desserts, beverages",3.9,300,new bel road
Eden Park,12.98308793,77.59860009,787,"andhra, biryani, chinese, north indian, seafood, south indian, sichuan",4,300,cunningham road
Slurpy Shakes,12.99222538,77.59426497,16,"beverages, ice cream, desserts",3.6,300,vasanth nagar
CupCake Noggins By CakeZone,13.028913,77.578968,22,"bakery, desserts",3.2,300,sanjay nagar
Vaibhav Biryani,12.99866704,77.55036592,448,biryani,4.3,300,rajajinagar
Gourmet Ice Cream Cakes By Baskin Robbins,13.011576,77.555428,8,"bakery, desserts, ice cream",4.1,300,malleshwaram
Shamsi's Rolls & Kebabs,13.00488181,77.60311961,97,"shawarma, north indian, chinese, mughlai, biryani, rolls, shake",3.8,300,frazer town
Nammura Naati Mane,13.0274324,77.5763795,12,"south indian, biryani",4,300,near sanjay nagar
Park Street,13.0351467,77.5636567,122,"north indian, bengali, chinese, street food, rolls, biryani, mishti",3.6,300,new bel road
Shree Sagar Veg Fast Food,12.97529817,77.5789234,7,"street food, beverages, shake",4.3,300,majestic
Sri Krishna Delicacy,13.02653695,77.58722713,127,"south indian, north indian",3.9,300,rt nagar
Hotel Karnataka,12.98389816,77.52856124,492,"south indian, chinese, seafood, north indian",3.8,100,magadi road
S M Sea Fishes,13.0232771,77.5923746,53,"fast food, kebab",4.2,100,rt nagar
Tasty Munch,13.00448,77.54983988,53,"fast food, sandwich, pizza, chinese, beverages, shake",3.9,100,rajajinagar
AR Cafe,13.015796,77.529576,222,"burger, pasta, pizza, sandwich, rolls, fast food, shake",3.9,100,peenya
Sri Ranganatha Military Hotel,12.95881287,77.56940659,9,south indian,3.9,100,basavanagudi
Naaan Veg Ootada Mane,13.01937897,77.56188534,5709,"north indian, mangalorean, seafood",3.1,100,yeshwantpur
Desi Vdesi,12.97550041,77.60324568,199,"north indian, fast food, beverages, shake, desserts",3.9,100,church street
Haji Ali Juice Centre,13.00085973,77.61305317,27,"beverages, desserts, ice cream, pizza",4,100,frazer town
Tawa Tandoor,13.04097825,77.56285228,327,"north indian, chinese, desserts, beverages",4.3,100,new bel road
Cafe Noir,13.01116633,77.55438421,1403,"continental, italian, mexican, french, waffle, beverages, desserts",4.3,100,malleshwaram
Smokin Burg,12.99540343,77.6141854,211,"burger, pizza, fast food, desserts, beverages, shake",4,100,frazer town
Sree Ganesha Fruit Juice Center,13.02987164,77.56201945,3,"beverages, juices, shake",4.2,500,new bel road
Infinitea Tea Room & Tea Store,12.98708894,77.59473488,944,"italian, european, healthy food, seafood, desserts, tea, shake",4.3,500,shivajinagar
Mysuru Sri Hanumanthu Palav,12.98684142,77.53722176,4,"mughlai, north indian",3.9,500,basaveshwara nagar
Andhra Meal Co,13.00617631,77.53518993,38,"andhra, desserts",3.8,500,basaveshwara nagar
Mubarak Restaurant,12.97758452,77.54379116,4,"north indian, chinese, kebab, sichuan",4,500,rajajinagar
Peppy Parathas & Rolls by Chai Point,13.0085283,77.5693717,7,"fast food, north indian, rolls, healthy food",3.9,500,malleshwaram
Venus Bar And Restaurant,13.02450286,77.54811656,151,"north indian, fast food, chinese, seafood, sichuan",3.9,500,yeshwantpur
Pebo,13.0290496,77.5707409,280,"italian, mediterranean, mexican, turkish",4,500,near sanjay nagar
